{
  "feature": "demo-pay",
  "generated_at": "2026-09-16T11:00:00Z",
  "template": {
    "id": "文档索引-模板",
    "version": "3.32.0"
  },
  "feature_name": "演示支付",
  "docs": [
    {
      "kind": "USER_DOC",
      "path": "docs/使用指南/demo-pay-使用指南.md",
      "sha256": "0000000000000000000000000000000000000000000000000000000000000000"
    },
    {
      "kind": "DEVELOPER_DOC",
      "path": "docs/使用指南/demo-pay-开发指南.md",
      "sha256": "0000000000000000000000000000000000000000000000000000000000000000"
    },
    {
      "kind": "API_DOC",
      "path": "docs/接口文档/demo-pay-接口文档.md",
      "sha256": "0000000000000000000000000000000000000000000000000000000000000000"
    },
    {
      "kind": "OPERATIONS_DOC",
      "path": "docs/运维手册/demo-pay-运维手册.md",
      "sha256": "0000000000000000000000000000000000000000000000000000000000000000"
    },
    {
      "kind": "RELEASE_NOTES",
      "path": "docs/发布/demo-pay-发布说明.md",
      "sha256": "0000000000000000000000000000000000000000000000000000000000000000"
    }
  ],
  "zero_results": []
}